{
  "schemaVersion": 1,
  "scenario": "warm-remote-cache",
  "scenarioLabel": "Warm cache, no changes",
  "sourceCommit": "2a2f0d6",
  "benchmarkRunId": "20260803T184828Z",
  "recordedAt": "2026-08-03T18:48:36.549213+00:00",
  "environment": {
    "profile": "local-benchmark",
    "os": "Darwin 25.5.0",
    "arch": "arm64",
    "cpuCores": 10,
    "memoryGb": 16.0,
    "javaVersion": "21.0.12",
    "buildToolVersion": "cnba 0.1.0-SNAPSHOT"
  },
  "repository": {
    "name": "sample-monorepo",
    "moduleCount": 12,
    "taskCount": 25
  },
  "graph": {
    "nodes": [
      {
        "id": "shared:build",
        "module": "shared",
        "kind": "build"
      },
      {
        "id": "shared:test",
        "module": "shared",
        "kind": "test"
      },
      {
        "id": "auth:build",
        "module": "auth",
        "kind": "build"
      },
      {
        "id": "auth:test",
        "module": "auth",
        "kind": "test"
      },
      {
        "id": "accounts:build",
        "module": "accounts",
        "kind": "build"
      },
      {
        "id": "accounts:test",
        "module": "accounts",
        "kind": "test"
      },
      {
        "id": "accounts:package",
        "module": "accounts",
        "kind": "package"
      },
      {
        "id": "catalog:build",
        "module": "catalog",
        "kind": "build"
      },
      {
        "id": "catalog:test",
        "module": "catalog",
        "kind": "test"
      },
      {
        "id": "search:build",
        "module": "search",
        "kind": "build"
      },
      {
        "id": "search:test",
        "module": "search",
        "kind": "test"
      },
      {
        "id": "payments:build",
        "module": "payments",
        "kind": "build"
      },
      {
        "id": "payments:test",
        "module": "payments",
        "kind": "test"
      },
      {
        "id": "pricing:test",
        "module": "pricing",
        "kind": "test"
      },
      {
        "id": "pricing:build",
        "module": "pricing",
        "kind": "build"
      },
      {
        "id": "orders:build",
        "module": "orders",
        "kind": "build"
      },
      {
        "id": "orders:test",
        "module": "orders",
        "kind": "test"
      },
      {
        "id": "notifications:build",
        "module": "notifications",
        "kind": "build"
      },
      {
        "id": "notifications:test",
        "module": "notifications",
        "kind": "test"
      },
      {
        "id": "storefront:build",
        "module": "storefront",
        "kind": "build"
      },
      {
        "id": "storefront:test",
        "module": "storefront",
        "kind": "test"
      },
      {
        "id": "storefront:package",
        "module": "storefront",
        "kind": "package"
      },
      {
        "id": "checkout:integration",
        "module": "checkout",
        "kind": "integration"
      },
      {
        "id": "checkout:package",
        "module": "checkout",
        "kind": "package"
      },
      {
        "id": "verify:contracts",
        "module": "verify",
        "kind": "contracts"
      }
    ],
    "edges": [
      {
        "from": "shared:build",
        "to": "shared:test"
      },
      {
        "from": "shared:build",
        "to": "auth:build"
      },
      {
        "from": "auth:build",
        "to": "auth:test"
      },
      {
        "from": "shared:build",
        "to": "accounts:build"
      },
      {
        "from": "accounts:build",
        "to": "accounts:test"
      },
      {
        "from": "auth:test",
        "to": "accounts:test"
      },
      {
        "from": "accounts:test",
        "to": "accounts:package"
      },
      {
        "from": "shared:build",
        "to": "catalog:build"
      },
      {
        "from": "catalog:build",
        "to": "catalog:test"
      },
      {
        "from": "catalog:build",
        "to": "search:build"
      },
      {
        "from": "search:build",
        "to": "search:test"
      },
      {
        "from": "shared:build",
        "to": "payments:build"
      },
      {
        "from": "payments:build",
        "to": "payments:test"
      },
      {
        "from": "shared:build",
        "to": "pricing:test"
      },
      {
        "from": "pricing:test",
        "to": "pricing:build"
      },
      {
        "from": "catalog:build",
        "to": "orders:build"
      },
      {
        "from": "payments:build",
        "to": "orders:build"
      },
      {
        "from": "orders:build",
        "to": "orders:test"
      },
      {
        "from": "shared:build",
        "to": "notifications:build"
      },
      {
        "from": "notifications:build",
        "to": "notifications:test"
      },
      {
        "from": "catalog:build",
        "to": "storefront:build"
      },
      {
        "from": "search:build",
        "to": "storefront:build"
      },
      {
        "from": "storefront:build",
        "to": "storefront:test"
      },
      {
        "from": "storefront:test",
        "to": "storefront:package"
      },
      {
        "from": "pricing:build",
        "to": "checkout:integration"
      },
      {
        "from": "payments:build",
        "to": "checkout:integration"
      },
      {
        "from": "orders:build",
        "to": "checkout:integration"
      },
      {
        "from": "auth:test",
        "to": "checkout:integration"
      },
      {
        "from": "checkout:integration",
        "to": "checkout:package"
      },
      {
        "from": "checkout:integration",
        "to": "verify:contracts"
      }
    ]
  },
  "changedFiles": [],
  "workerCount": 4,
  "cacheState": "warm",
  "tasks": [
    {
      "id": "shared:build",
      "status": "CACHE_HIT",
      "reason": "restored from cache",
      "dependsOn": [],
      "durationMs": 0,
      "worker": "executor-1"
    },
    {
      "id": "accounts:build",
      "status": "CACHE_HIT",
      "reason": "restored from cache",
      "dependsOn": [
        "shared:build"
      ],
      "durationMs": 0,
      "worker": "executor-3"
    },
    {
      "id": "auth:build",
      "status": "CACHE_HIT",
      "reason": "restored from cache",
      "dependsOn": [
        "shared:build"
      ],
      "durationMs": 0,
      "worker": "executor-1"
    },
    {
      "id": "auth:test",
      "status": "CACHE_HIT",
      "reason": "restored from cache",
      "dependsOn": [
        "auth:build"
      ],
      "durationMs": 0,
      "worker": "executor-1"
    },
    {
      "id": "accounts:test",
      "status": "CACHE_HIT",
      "reason": "restored from cache",
      "dependsOn": [
        "accounts:build",
        "auth:test"
      ],
      "durationMs": 0,
      "worker": "executor-1"
    },
    {
      "id": "accounts:package",
      "status": "CACHE_HIT",
      "reason": "restored from cache",
      "dependsOn": [
        "accounts:test"
      ],
      "durationMs": 0,
      "worker": "executor-1"
    },
    {
      "id": "catalog:build",
      "status": "CACHE_HIT",
      "reason": "restored from cache",
      "dependsOn": [
        "shared:build"
      ],
      "durationMs": 0,
      "worker": "executor-1"
    },
    {
      "id": "catalog:test",
      "status": "CACHE_HIT",
      "reason": "restored from cache",
      "dependsOn": [
        "catalog:build"
      ],
      "durationMs": 0,
      "worker": "executor-1"
    },
    {
      "id": "notifications:build",
      "status": "CACHE_HIT",
      "reason": "restored from cache",
      "dependsOn": [
        "shared:build"
      ],
      "durationMs": 0,
      "worker": "executor-2"
    },
    {
      "id": "notifications:test",
      "status": "CACHE_HIT",
      "reason": "restored from cache",
      "dependsOn": [
        "notifications:build"
      ],
      "durationMs": 0,
      "worker": "executor-2"
    },
    {
      "id": "payments:build",
      "status": "CACHE_HIT",
      "reason": "restored from cache",
      "dependsOn": [
        "shared:build"
      ],
      "durationMs": 0,
      "worker": "executor-1"
    },
    {
      "id": "orders:build",
      "status": "CACHE_HIT",
      "reason": "restored from cache",
      "dependsOn": [
        "catalog:build",
        "payments:build"
      ],
      "durationMs": 0,
      "worker": "executor-1"
    },
    {
      "id": "orders:test",
      "status": "CACHE_HIT",
      "reason": "restored from cache",
      "dependsOn": [
        "orders:build"
      ],
      "durationMs": 0,
      "worker": "executor-1"
    },
    {
      "id": "payments:test",
      "status": "CACHE_HIT",
      "reason": "restored from cache",
      "dependsOn": [
        "payments:build"
      ],
      "durationMs": 0,
      "worker": "executor-1"
    },
    {
      "id": "pricing:test",
      "status": "CACHE_HIT",
      "reason": "restored from cache",
      "dependsOn": [
        "shared:build"
      ],
      "durationMs": 0,
      "worker": "executor-1"
    },
    {
      "id": "pricing:build",
      "status": "CACHE_HIT",
      "reason": "restored from cache",
      "dependsOn": [
        "pricing:test"
      ],
      "durationMs": 0,
      "worker": "executor-1"
    },
    {
      "id": "checkout:integration",
      "status": "CACHE_HIT",
      "reason": "restored from cache",
      "dependsOn": [
        "pricing:build",
        "payments:build",
        "orders:build",
        "auth:test"
      ],
      "durationMs": 0,
      "worker": "executor-2"
    },
    {
      "id": "checkout:package",
      "status": "CACHE_HIT",
      "reason": "restored from cache",
      "dependsOn": [
        "checkout:integration"
      ],
      "durationMs": 0,
      "worker": "executor-2"
    },
    {
      "id": "search:build",
      "status": "CACHE_HIT",
      "reason": "restored from cache",
      "dependsOn": [
        "catalog:build"
      ],
      "durationMs": 0,
      "worker": "executor-1"
    },
    {
      "id": "search:test",
      "status": "CACHE_HIT",